<?xml version="1.0" encoding="UTF-8"?>
<!DOCTYPE toolbox SYSTEM "main_menu.dtd">
<toolbox name="DefaultModuleTree">
  <label>Default GRASS module tree</label>
  <items>
    <subtoolbox name="ImportExportLink"/>
    <subtoolbox name="ManageMaps"/>
    <subtoolbox name="Region"/>
    <subtoolbox name="Raster"/>
    <subtoolbox name="Vector"/>
    <subtoolbox name="Imagery"/>
    <subtoolbox name="Volumes"/>
    <subtoolbox name="Database"/>
    <subtoolbox name="Temporal"/>
    <subtoolbox name="GuiTools"/>
    <subtoolbox name="Other"/>
    <user-toolboxes-list/>
    <addons/>
  </items>
</toolbox>
